exp_method_id,exp_method_code,exp_method_translation,exp_method_desc,reference_id,exp_category
111,KNO3,Potassium nitrate (CMIBS method),Digestion with potassium nitrate (originally a CMIBS method),NULL,NULL
116,LMF,Lithium metaborate (LiBO2) fusion,Lithium metaborate (LiBO2) fusion,NULL,NULL
324,LMF_2AE/CE,"Lithium metaborate flux, anion (x2) and cation exchange chromatography","Lithium metaborate flux, double-spike, anion exchange AG1-X8, anion exchange microcolumns AG1-X8, cation exchange AG50W-X8. Ox. prior to 1st col. potassium peroxidisulfate (K2S2O8) OR prior to 2nd column with ammonium persulfate ((NH4)2S2O8)",NULL,metal_isotope
186,LMF_HNO3(5%),"Lithium metaborate fusion, 5% HNO3 (see e.g. Bureau Veritas method 4A-4B)","Lithium metaborate (LiBO2) fusion, followed by dilute nitric (HNO3) acid digestion. See e.g. Bureau Veritas method 4A-4B.",NULL,NULL
155,LMF_MA2c,"Lithium metaborate fusion, HF/HClO4 digest","Lithium metaborate (LiBO2) fusion, followed by hydroflouric (HF) and perchloric (HClO4) acid digestion.",NULL,NULL
43,LTF,Lithium tetraborate (aka lithium borate) fusion,"Lithium tetraborate (Li2B4O7) fusion, aka lithium borate fusion.",NULL,NULL
185,LTF_HNO3,"Lithium tetraborate fusion, HNO3","Lithium tetraborate (Li2B4O7) fusion, followed by nitric (HNO3) acid digestion, likely dilute (no strength mentioned)",NULL,NULL
172,LTF_MA3b,"Lithium tetraborate fusion, HNO3/HF/HClO4 digest","Lithium tetraborate (Li2B4O7) fusion, followed by multi-acid digest. See e.g. fusion-dissolution method for ICP:MS at GeoAnalytical Lab WSU",NULL,NULL
184,LTMF,Lithium tetraborate/metaborate fusion,Lithium tetraborate (Li2B4O7) and/or metaborate (LiBO2) fusion,NULL,NULL
277,LTMF_CE,"Lithium tetraborate/metaborate fusion, cation exchange chromatography (LN resin)","Dissolved by flux fusion (lithium tetraborate, lithium metaborate, lithium bromide), heated, quenched with HNO3, Sm and Nd of spiked aliquot separated with Eichrom LN Resin",NULL,metal_isotope
300,LTMF_HNO3(2%),"Lithium tetraborate/metaborate fusion, 2% HNO3","Lithium tetraborate (Li2B4O7) and/or metaborate (LiBO2) fusion, followed by dilute nitric (HNO3) acid digestion. See e.g. LabWest method AF-03",NULL,NULL
190,LTMF_HNO3(5%),"Lithium tetraborate/metaborate fusion, 5% HNO3","Lithium tetraborate (Li2B4O7) and/or metaborate (LiBO2) fusion, followed by dilute nitric (HNO3) acid digestion. See e.g. Actlabs method FUS-ICP, FUS-MS",NULL,NULL
301,LTMF_HNO3(dil),"Lithium tetraborate/metaborate fusion, dilute HNO3","Lithium tetraborate (Li2B4O7) and/or metaborate (LiBO2) fusion, followed by dilute nitric (HNO3) acid digestion. See e.g. LabWest method AF-04 (no strength mentioned)",NULL,NULL
164,LaserFluor,Laser fluorination,"Extraction of oxygen with laser and fluorinating agent (e.g. BrF5), for isotopic analysis",NULL,NULL
17,LeachFurnace,Leach and furnace (SGS method),See CSA04V method of SGS,NULL,NULL
210,Lord1982,Pyrite sensu Lord 1982,"Pretreatment with citrate-bicarbonate-dithionite solution, followed by a hydrofluoric-boric acid solution, quantitatively dissolved in quartz-distilled nitric acid, atomic absorption spectrophotometry.",NULL,NULL
102,MA,"Multi-acid digestion, details unknown","Multi acid digestion, details unknown",NULL,element
36,MA2,HNO3/HF,Two-acid digestion with nitric acid and hydrofluoric acid,NULL,element
327,MA2/H202_AE/CE,"HNO3/HF digest, H202, HNO3/HCl, anion exchange (AG1X8 resin), cation exchange (50W-X8 resin).","Digest in HF/HNO3, double spike, treated with H2O2, dissolved in HCl and HNO3, anion exchange chromatography Eichrom AG1-X8 resin (HCl eluent), cation exchange chromatography  Eichrom 50W-X8 (HNO3 eluent). See Ossa Ossa et al. 2022 refs therein.",NULL,metal_isotope
276,MA2_2CE,"HF/HNO3, two-step cation exchange chromatography (Sm Nd with LN resin)","Dissolved in HF-HNO3, +/-HNO3 and HCl added, REE/LREE by cation exchange before Sm and Nd using Eichrom LN Resin",NULL,metal_isotope
352,MA2_AE,"HF/HNO3, anion exchange chromatography (AG1X8 resin), sample-standard bracketing","HNO3/HCl/HF, anion exchange chromatography with AG1 X8 or AG MP-1 resin, sample-standard bracketing.",NULL,NULL
166,MA2_AE(HBr-HCl),"HF/HNO3, converted with HCl, dissolved in HBr, anion exchange chromatography","HF and HNO3 digest, to chlorides with HCl, dissolved in HBr, anion exchange BioRad AG-1X8 resin. See Kamber and Gladu 2009",NULL,metal_isotope
273,MA2_AE/CE,"HNO3/HF, anion exchange (AG1X8 resin), cation exchange (AG50W-X8 resin)","HF/HNO3 digestion, followed by two-step anion exchange AG1-X8 resin and cation exchange AG50W-X8 resin. See e.g. Barling et al. 2001, Duan et al. 2010.",NULL,metal_isotope
158,MA2_H3BO3,"HF/HNO3, neutralized with H3BO3","NOT USED Digest with HF and HNO3, neutralization with boric acid to retain Si",NULL,NULL
92,MA2b,HCl/HF,Two-acid digestion with hydrochloric acid and hydrofuoric acid,NULL,element
196,MA2b_ZnBR_SOX,"HCl/HF, heavy liquid sep in ZnBr, soxhlet type extraction","Treated with acid (HCl/HF) followed by heavy-liquid separation in a zinc bromide solution, followed by solvent extraction by Soxhlet",NULL,NULL
135,MA2b_ZnBr,"HCl/HF,  heavy liquid separation in ZnBr","Multi acid digestion to remove carbonate and silicates, followed by heavy liquid separation to separate kerogen",NULL,NULL
107,MA2c,HClO4/HF,NOT USED Two-acid digestion with perchloric acid and hydrofluoric acid,NULL,element
114,MA2d,HF/H2SO4 (CMIBS method),Two-acid digestion with hydrofluoric acid and sulfuric acid (originally a CMIBS method),NULL,element
136,MA2e,HClO4/H3PO4,Two acid digestion with perchloric and phosphoric acid,NULL,element
192,MA2g,HNO3/HCl,NOT USED Digest in HNO3/HCl,NULL,element
220,MA2g/BrCl_AE,"HNO3/HCl and BrCl digest, anion exchange chromatography","HNO3/HCl/BrCl digest, anion exchange AG1-X4 resin chromatography ",NULL,metal_istotope
235,MA2g_AE,"HNO3/HCl, HCl(6M), anion exchange chromatography (AG1X8 resin)","HCl/HNO3, double spike, re-dissolved in 6M HCl, one-step anion exchange Eichrom AG1-X8 resin (HCl eluent). See Ossa Ossa et al. 2022, König et al. 2019.",NULL,metal_isotope
252,MA2h,HF/AR,Hydroflouric acid and aqua regia,NULL,element
265,MA2h_AE/CE,"HF/AR, anion and cation exchange chromatography","Digest in HF and aqua regia, double spike, ammonium persulfate ((NH4)2S2O8), anion exchange AG1-X8 resin, cation exchange AG50-WX8 resin",NULL,metal_isotope
20,MA3,HNO3/HCl/HF,"Three acid digestion with nitric acid, hydrochloric acid and hydrofluoric acid",NULL,element
227,MA3_AE,"HNO3/HCl/HF, anion exchange chromatography (AG1X8 or AGMP1 resin), sample-standard bracketing","HNO3/HCl/HF, anion exchange chromatography with AG1 X8 or AG MP-1 resin, sample-standard bracketing.",NULL,metal_isotope
234,MA3_AE/CE,"HNO3/HCl/HF, anion exchange (AG1X8 resin), cation exchange (AG50W-X8 resin)","HF/HNO3/HCl digestion, followed by two-step anion exchange AG1-X8 resin and cation exchange AG50W-X8 resin. See e.g. Barling et al. 2001, Duan et al. 2010.",NULL,metal_isotope
96,MA3_AR,"HNO3/HCl/HF, AR","Three-acid digestion with nitric acid, hydrochloric acid and hydrofluoric acid followed by aqua regia digest",NULL,element
304,MA3_H2O2,"HNO3/HCl/HF, H2O2",HNO3/HCl/HF followed by H2O2 to remove organic residues,NULL,element
207,MA3_IE,"HF/HNO3/HCl, ion exchange chromatography (UTEVA resin)","Digestion by HF/HNO3/HCl, ion exchange chromatography UTEVA resin",NULL,metal_isotope
52,MA3b,HF/HNO3/HClO4,"Three acid digestion with hydrofluoric acid, nitric acid and perchloric acid",NULL,element
268,MA3b_2CE,"HF/HNO3/HClO4, HCl/HNO3, two-step cation exchange chromatography  (AG50W-X12 resin)","HF/HNO3/HClO4 digest, conc HCl and HNO3, two column cation exchange chromatography AG 50W-X12 resin. See Pogge von Strandmann et al. 2011, James and Palmer 2000.",NULL,metal_isotope
326,MA3b_3CE,"HF/HNO3/HClO4 digest, HCl/HNO3, three cation exchange chromatography","HF and HNO3, followed by HNO3 and HCl (+/- perchloric acid), three-column cation exchange AG 50W-X12 resin chromatography. See Moriguti and Nakamura 1998 (first three columns)",NULL,metal_isotope
362,MA3b_AE/CE,"HF/HNO3/HClO4, anion exchange (AG1X8 resin), cation exchange (AG50W-X8 resin)","HF/HNO3/HCl digestion, followed by two-step anion exchange AG1-X8 resin and cation exchange AG50W-X8 resin",NULL,NULL
171,MA3b_AR,"HNO3/HF/HClO4, AR","Three-acid digestion with nitric acid, hydroflouric acid and perchloric acid, taken up and dissolved in AR",NULL,element
290,MA3b_AR_AE,"HNO3/HF/HClO4, aqua regia, anion exchange chromatography (AGMP1 resin), sample-standard bracketing","HNO3/HF/HClO4, AR, anion exchange chromatography",NULL,metal_isotope
93,MA3b_H3BO3,"HNO3/HF/HClO4 digest, H3BO3","Acid digestion with nitric acid, hydrofluoric acid, perchloric acid and boric acid (used to prevent formation of Al complexes).",NULL,element
341,MA3b_IE,"HF/HNO3/HClO4, ion exchange chromatography (UTEVA resin)","Three acid digestion with hydrofluoric acid, nitric acid and perchloric acid, followed by ion exchange chromatography with UTEVA resin. See e.g. Weyer et al. 2008.",NULL,metal_isotope
83,MA3b_TCF,"HF/HClO4/HNO3, TCF filter (Method D of Stüeken et al. 2013)","HF-HClO4-HNO3 digest, filtered with thiol cotton fibers (TCF), Se desorbed with HNO3 redissolved in HCl for analysis. Method D of Stüeken et al. 2013.",NULL,metal_isotope
89,MA3b_TCF+/-AR,"HF/HClO4/HNO3, TCF filter +/- Aqua regia (Average of Method D and Method E of Stüeken et al. 2013)","HF-HClO4-HNO3 digest, filtered with thiol cotton fibers (TCF), +/- treatment with Aqua Regia, Se desorbed with HNO3 and redissolved in HCl for analysis. Average of Method D and Method E of Stüeken et al. 2013.",NULL,metal_isotope
86,MA3b_TCF_AR,"HF/HClO4/HNO3, TCF filter, Aqua Regia (Method E of Stüeken et al. 2013)","HF-HClO4-HNO3 digest, filtered with thiol cotton fibers (TCF), treated with Aqua Regia, Se desorbed with HNO3 partially evaporated and redissolved in HCl for analysis. Method E of Stüeken et al. 2013.",NULL,metal_isotope
162,MA3d,HNO3/HF/AR,"NOT USED Acid digestion in HNO3 and HF, Aqua Regia",NULL,element
14,MA4,HNO3/HClO4/HF/HCl,"Four acid digestion with nitric acid, perchloric acid, hydrofluoric acid and hydrochloric acid. Common commercial lab method see e.g. MA200, MA250, Ultratrace 4",NULL,element
366,MA4(unk),"Four-acid digest, details unknown","Four-acid digest, details unknown",NULL,NULL
115,MA4_IE,HF/HCl/HNO3/HClO4 and ion exchange separation.,"Four acid digestion with hydrofluoric acid, hydrochloric acid, nitric acid and perchloric acid and ion exchange separation",NULL,metal_istopes
329,MA4_IE(TRUresin),"HF/HCl/HNO3/HClO4, ion exchange separation (TRU resin)","Four acid digestion with hydrofluoric acid, hydrochloric acid, nitric acid and perchloric acid, ion exchange separation with TRU resin for uranium isotopes. See Dang et al. 2016, 2018.",NULL,metal_isotope
160,MA4c,HF/HNO3/AR/HCl,"NOT USED Digestion in HF and HNO3, followed by digestion in aqua regia, and HCl",NULL,element
40,MA5,HNO3/HClO4/HF/H3BO3/HCl,"Five acid digestion with nitric acid, perchloric acid, hydrofluoric acid, boric acid and hydrochloric acid",NULL,element
121,MA_HF,Multi-acid digestion with HF (CMIBS method),Multi-acid digestion with hydrofluoric acid (originally a CMIBS method),NULL,element
303,M_MA3,"Microwave digest, HNO3/HCl/HF","Microwave digest followed by three acid digestion with nitric acid, hydrochloric acid and hydrofluoric acid",NULL,element
320,M_MA3_H202,"Microwave digest, HNO3/HCl/HF, H2O2","Microwave digest followed by three acid digestion with nitric acid, hydrochloric acid and hydrofluoric acid, followed by addition of H2O2 to remove organics",NULL,element
193,M_MA4,Microwave + acid digest (Labwest method),Microwave assisted HF-based 4-acid digest (originally a Labwest method),NULL,element
248,MeOH_2CE,"Methanol/ultrasonic cleaning, two-stage cation exchange chromatography (AG50W-X12 resin)","Methanol (+/-ultrasonic) followed by two column cation exchange chromatography AG 50W-X12 resin (HCl as eluent). See Pogge von Strandmann et al. 2011, James and Palmer 2000.",NULL,metal_isotope
258,MeOH_NH4OAc(0.2M)_AcOH(0.5M)_CE,"Methanol, 0.2M ammonium acetate, 0.5M acetic acid, cation exchange (Sr Spec resin)","Methanol, 0.2 M ammonium acetate, 0.5 M acetic acid at room temperature for 2 h to dissolve the calcite fraction, cation exchange chromatography with Eichrom Sr Spec resin",NULL,metal_isotope
133,NH4Ac(0.2M)_AcOH(0.5M)_CE,"0.2M ammonium acetate, 0.5M acetic acid, cation exchange (Sr Spec resin)","0.2 M ammonium acetate (pH approx. 8.2), 0.5M acetic acid, cation exchange  with Eichrom Sr Spec resin",NULL,metal_isotope
215,NH4Ac(1M),1M ammonium acetate ,Digestion using 1 M ammonium acetate solution,NULL,carbonate_proxy
342,NH4Ac(1M)_2IE(REresin),"NH4Ac(1M), ion exchange chromatography (RE resin)","Digestion using 1 M ammonium acetate solution, two step ion exchange chromatography using RE Resin (Triskem)",NULL,metal_isotope
253,NH4Ac(1M)_HCl(0.05NSeq)_CE,"1M ammonium acetate, 0.05N HCl in 4hr/2hr/10min seq. steps, cation exchange (AG50W-X12 resin)","leached in 1M ammonium acetate, dissolved in three steps (4h, 2h and 10 minutes) into a 0.05N hydrochloric acid solution [..] redissolved in 6N HCl, cation exchange chromatography AG50W-X12 resin",NULL,metal_isotope
340,NH4Ac(1M)_IE,"1M NH4Ac, ion exchange chromatography",blahblah,NULL,metal_isotope
368,NH4Cl(2MSeq),2M NH4Cl sequential extraction,"Fish debris extraction sensu Schenau & De Lange, 2000. 2 M NH4Cl multiple times.",NULL,NULL
163,NH4HF2,Digestion with NH4HF2,Digestion with NH4HF2 according to the method of Zhang et al. 2012,NULL,NULL
289,NH4VO3/HF_K2CrO4,Ammonium metavanadate/HF acid digestion with K2CrO4,Ammonium metavanadate/HF acid digestion with K2CrO4,NULL,NULL
109,Na2CO3/ZnOFus,Sodium carbonate and zinc oxide sinter digestion. (CMIBS method),Sodium carbonate (Na2CO3) and zinc oxide (ZnO) sinter digestion (originally a CMIBS method).,NULL,NULL
76,Na2O2Fus,Sodium peroxide sinter/fusion,Sodium peroxide sinter/fusion,NULL,NULL
105,NaCl(rep)/HCl/BaCl2,"NaCl (repeated leaches), HCl, BaCl2 (Wotte et al. 2012)","Repeated NaCl leaching, HCl, precipitation of BaSO4 with BaCl2. Method of Wotte et al. 2012.",804,NULL
313,NaCl/HCl/BaCl2,"NaCl (single leach), HCl, BaCl2","Single leach with NaCl, HCl, precipitation of BaSO4 with BaCl2. ",NULL,NULL
48,NaCl/NaOCl/HCl,"NaCl and NaOCl(bleach), HCl","Treated with NaCl and NaOCl, HCl",NULL,NULL
33,NaCl/NaOCl/HCl/BaCl2,"NaCl and NaOCl(bleach), HCl, BaCl2","Treated with NaCl and NaOCl, HCl, BaCl2 to precipitate BaSO4.",NULL,NULL
346,NaOAc(1M),1M sodium acetate (AcOH buffered),"1M sodium acetate, pH 4 with acetic acid",NULL,NULL
267,NaOAc(1M)_2CE,"1M sodium acetate (AcOH buffered), two stage cation exchange chromatography  (AG50W-X12 resin)","weak leach of 1 M Na acetate buffered to pH 5 with acetic acid, two-column cation exchange chromatography AG 50W-X12 resin HCl as an eluent. See Pogge von Strandmann 2011, James and Palmer 2000.",NULL,metal_isotope
213,NaOAc(1M)_IE,"1M sodium acetate, ion exchange chromatography (UTEVA resin)","Selective digest in 1M sodium acetate buffer solution, ion exchange chromatography with UTEVA resin",NULL,metal_isotope
174,NaOAc(1M)_MA3b,"Sum of extract first with sodium acetate, followed by HF/HNO3/HClO4 digestion",Sequential extraction modified SeqA acetate extraction followed by multi-acid (nitric/hydrofluoric/perchloric) digestion. See Adeboye et al. 2020.,NULL,NULL
314,NaOCl/HCl/BaCl2,"NaOCl(bleach), HCl, BaCl2 (summary in Gill et al. 2008)","Treated with sodium hypochlorite (NaOCl), HCl, BaCl2 to precipitate BaSO4. Modified Burdett et al. (1987) method, as summarized in Gill et al. (2008).",805,NULL
117,NiS_FA,NiS fire assay chemical separation. (CMIBS method),NiS fire assay chemical separation (originally a CMIBS method),NULL,NULL
204,Oriented mount,Oriented mount,Oriented mount for XRD,NULL,NULL
101,Part_digest,Partial digestion (NGDB method),"Partial digestion, no details provided (originally a NGDB method)",NULL,NULL
118,PbO_FA,PbO fire assay chemical separation (CMIBS method),PbO fire assay chemical separation (originally a CMIBS method),NULL,NULL
199,Polished briquette,Polished briquette,"Mounted in plastic/resin, ground and polished (typically to 0.05 µm) for reflected-light petrography and vitrinite/bitumen reflectance see e.g. ASTM D2797/D7708.",NULL,NULL
128,Pressed pellet,Pressed powder pellet,"Pressed powder pellet, mostly for XRF analysis, also SEM-EDS. Various preparation methods. ",NULL,NULL
124,RC,Radiochemical separation (CMIBS method),Radiochemical separation (originally a CMIBS method),NULL,NULL
191,Random mount,Random/unoriented mount,Random/unoriented powder mount for XRD,NULL,NULL
322,Raw powder,Raw powder,"Raw powder, no preparation. For XRF may be covered with a thin film.",NULL,NULL
51,Roast_380deg,Roasted at 380degC,Roasted at 380degC,NULL,NULL
177,Roast_850deg,Roasted at 850degC,Roasted at 850degC,NULL,NULL
323,Rock surface,"Rock surface (cut, sometimes polished)","Rock surface, mostly cut and sometimes polished, for direct XRF analysis",NULL,NULL
194,SOX(DCM),Soxhlet type extraction with dichloromethane,Soxhlet type extraction with dichloromethane,NULL,NULL
153,SOX(DCM)_MA2b,"Soxhlet dichloromethane-extraction, HF/HCl",Dichloromethane-extraction procedure (modified from Durand and Nicaise 1980) followed by HF-HCl treatment,NULL,NULL
243,SOX(DCM)_MA3,"Soxhlet dichloromethane-extraction, HF/HCl/HNO3","Dichloromethane-extraction procedure, followed by HCl, HF and HCl, and HNO3 digests",NULL,NULL
315,SOX(TCM),Soxhlet type extraction with trichloromethane (aka chloroform),Soxhlet type extraction with trichloromethane (aka chloroform),NULL,NULL
3,SeqA,"Sodium acetate extraction, 48hr, 50degC (Poulton and Canfield 2005)",1M sodium acetate solution (at 50degC) buffered with acetic acid to pH 4.5 for 48 hours,2,iron_sulfur
1,SeqA(24h),"Sodium acetate extraction, 24hr",1M sodium acetate solution buffered with acetic acid to pH 4.5 for 24 hours,2,iron_sulfur
143,SeqA(RoomTemp),"Sodium acetate extraction, 48hr, room temperature","1M sodium acetate solution buffered with acetic acid to pH 4.5 for 48 hours, at room temperature",NULL,iron_sulfur
358,SeqABphos,"1 M Na-­acetate (pH=4), 1 M MgCl2(pH=8)","1.0 (+/-0.1) g of powdered sample to 60 mL solution ratio shaken in 1 M Na-­acetate (pH=4), 1 M MgCl2(pH=8), and DI water (mod of Anderson and Delaney 2000, see Beaty 2025)",NULL,NULL
54,SeqAphos,"CDB pH 7.6 8h (Ruttenberg 1992, Thompson et al. 2019)","0.3 M sodium-citrate, 1 M sodium bicarbonate, and 0.14 M sodium dithionite (pH = 7.6) for 8h",244,sedex
4,SeqB,"Sodium dithionite extraction, 2hr (Poulton and Canfield 2005)",2 hrs with 50g/L sodium dithionite solution buffered with 0.35M acetic acid and 0.2M sodium citrate to pH4.8,2,iron_sulfur
30,SeqB(6h),"Sodium dithionite extraction, 6hr","Citrate-buffered (pH 4.8) sodium dithionite solution, 6hr (modified step in Poulton and Canfield 2005 sequential extraction)",NULL,iron_sulfur
57,SeqBphos,"Na Acetate pH 4.0 6h (Ruttenberg 1992, Thompson et al. 2019)",1 M sodium acetate (pH = 4.0) 6h,244,sedex
5,SeqC,"Ammonium oxalate extraction, 6hr (Poulton and Canfield 2005)",6hrs with 0.2M ammonium oxalate and 0.17M oxalic acid solution buffered with ammonium hydroxide to pH 3.2,2,iron_sulfur
223,SeqC+Ephos_Guilbaud,SeqC_phos + MA5 after SeqD_phos,"HNO3-HF-HClO4-H3BO3-HCl extraction after SeqD_phos. Step added in Guilbaud et al. 2020 - assume is summed with the amount from SeqC_phos for the total ""P-det"" in the data sheet. See discussion in supp info of Guilbaud et al. 2020.",NULL,sedex
58,SeqCphos,"1M HCl 16hr (Ruttenberg 1992, Thompson et al. 2019)",1 M HCl 16h,244,sedex
59,SeqDphos,"Ash 550decC, HCl (Ruttenberg 1992).",1 M HCl after ignition at 550degC,244,sedex
147,SeqDphos(mod),Ammonium oxalate 6h (Thompson et al. 2019),Ammonium oxalate extraction for 6h.Takes place after SeqC_phos.,240,sedex
148,SeqEphos(mod),CDA ph 4.8 6h (Thompson et al. 2019),Sodium citrate-dithionite-acetate extraction (ph 4.8) for 6hrs. Takes place after SeqD_phos_mod,240,sedex
149,SeqFphos(mod),"Ash 550degC, 1M HCl 6h (Thompson et al. 2019)","Ashed at 550degC, then 1M HCl for 6hrs. Equivalent method to SeqD_phos, but takes place after SeqE_phos_mod.",240,sedex
25,SeqOBS,Sequential sulfur extraction AVS/CRS/CB/BaCl2,"Sequential wet chemical extraction for organically-bound sulfur - AVS with cold HCl, CRS, combustion, precipitation as BaSO4 using BaCl2 +/- treatment with NaCl",NULL,iron_sulfur
230,SeqPy_AE,"Seq extract of pyrite with HNO3, anion exchange (AGMP1 resin), sample-standard bracketing","Fe-py extracted using 16 M HNO3 (after extraction of oxides/clay via HCl, aluminosilicate via HF), anion exchange chromatography with AGMP-1 resin, sample-standard bracketing. Procedure as in Arnold et al. 2004.",NULL,metal_isotope
359,SeqResPhos,Multi-acid after sequential phos extraction,Multi-acid extraction (MA3) for residual phos extraction after sequential extraction steps (see also SeqC+Ephos_Guilbaud),NULL,NULL
125,Sinter,"Sinter, unspecified (CMIBS method)","Sinter, unspecified (originally a CMIBS method)",NULL,element
100,Tot_digest,Total digestion (NGDB method),"Total digestion, no details provided. (originally a NGDB method)",NULL,element
127,WO_H2SO4,Wet oxidation with H2SO4 (CMIBS method),Wet oxidation with H2SO4 (originally a CMIBS method),NULL,carbon